{
  "capabilities": {
    "core_host_capabilities": {
      "cap_apparmor": {
        "description": "AppArmor reporting; never lowered for certification",
        "type": "diagnostic_only"
      },
      "cap_architecture": {
        "description": "Supported CPU architecture for selected methods",
        "supported_values": [
          "x86_64",
          "aarch64"
        ],
        "type": "required"
      },
      "cap_dns_backend": {
        "description": "A supported DNS backend such as systemd-resolved, NetworkManager DNS, netconfig/wicked (openSUSE), or static resolv.conf",
        "type": "required"
      },
      "cap_kernel": {
        "description": "Linux kernel exposing the capabilities WatchdogVPN requires",
        "type": "required"
      },
      "cap_network_manager": {
        "description": "NetworkManager (admitted equivalents: Wicked for openSUSE SUSE family)",
        "type": "required"
      },
      "cap_nftables": {
        "description": "nftables backend required for the atomic kill switch",
        "type": "required"
      },
      "cap_package_manager": {
        "description": "Family package manager used for bootstrap and runtime packages",
        "type": "required"
      },
      "cap_persistence": {
        "description": "Installed state survives reboot and can be audited",
        "type": "required"
      },
      "cap_policy_routing": {
        "description": "ip rule and route capability required by capture and split tunnel",
        "type": "required"
      },
      "cap_polkit": {
        "description": "Polkit privileged-action support",
        "type": "required"
      },
      "cap_python310": {
        "description": "Final product runtime Python floor; bootstrap reader only requires Python 3.6",
        "type": "provisionable"
      },
      "cap_rollback": {
        "description": "Provisioner rollback and uninstall capability",
        "type": "required"
      },
      "cap_selinux": {
        "description": "SELinux reporting; never lowered for certification",
        "type": "diagnostic_only"
      },
      "cap_firewalld": {
        "description": "firewalld reporting; never lowered for certification",
        "type": "diagnostic_only"
      },
      "cap_sudo": {
        "description": "Privilege elevation path",
        "type": "required"
      },
      "cap_systemd": {
        "description": "systemd init and service semantics",
        "type": "required"
      },
      "cap_tun": {
        "description": "/dev/net/tun support",
        "type": "required"
      },
      "cap_base_runtime_commands": {
        "description": "Base command/runtime package surface currently required by legacy package reconciliation",
        "type": "provisionable"
      },
      "cap_python_cryptography": {
        "description": "Python cryptography module for product runtime operations that require cryptographic primitives",
        "type": "provisionable"
      },
      "cap_dns_runtime_package": {
        "description": "Distribution DNS helper package required when the selected DNS backend needs package support",
        "type": "provisionable",
        "dns_backend_policy": {
          "systemd_resolved": {
            "helper_requirement": "satisfied_by_backend"
          },
          "networkmanager": {
            "helper_requirement": "satisfied_by_backend"
          },
          "static_resolv_conf": {
            "helper_requirement": "optional"
          },
          "unknown": {
            "helper_requirement": "unknown"
          }
        }
      }
    },
    "protocol_capabilities": {
      "proto_amneziawg_runtime": {
        "description": "awg tools plus AmneziaWG kernel module or amneziawg-go",
        "type": "provisionable"
      },
      "proto_ck_client_runtime": {
        "description": "Cloak ck-client runtime",
        "type": "provisionable"
      },
      "proto_openvpn_runtime": {
        "description": "OpenVPN runtime",
        "type": "provisionable"
      },
      "proto_sing_box_runtime": {
        "description": "sing-box runtime used by VLESS, Trojan, Hysteria2, VMess, TUIC, Shadowsocks, SOCKS and HTTP",
        "type": "provisionable"
      }
    }
  },
  "certifications": {
    "cert_opensuse_tumbleweed_rolling": {
      "current": true,
      "date": "2026-09-10T00:00:00Z",
      "distribution": "opensuse_tumbleweed",
      "evidence": "23.7.5.11D openSUSE Tumbleweed 20260907 field certification on nls1 (runtime eb969bd, generation SHA-256 c21912e05a6c82b894f1b5f979a04fae132520fc6ac25cda41d3d44b24a1fc0d, provenance verified): 12/12 protocols green with real egress (T4.1 protocol matrix, TW-E04), AmneziaWG resolved through the guided official provisioning flow and validated with real AWG egress; reboot lifecycle (T5, TW-E06), isolated fault harness (T6, TW-E07) and final cleanup (T7, TW-E08) CLOSED/APPROVED by independent audit 2026-09-11",
      "protocol_results": {
        "amneziawg": {
          "disposition": "green",
          "evidence": "real AWG egress via the guided official provisioning flow: 9/9 HTTPS 200 through the tunnel (example/github/ipify), tunnel egress distinct from direct, kill switch applied (23.7.5.11D T4.1 AWG resolution, TW-E04)"
        },
        "http": {
          "disposition": "green",
          "evidence": "real egress HTTP 200x3 through the tunnel (23.7.5.11D T4.1 Tumbleweed matrix, TW-E04)"
        },
        "hysteria2": {
          "disposition": "green",
          "evidence": "real egress HTTP 200x3 through the tunnel (23.7.5.11D T4.1 Tumbleweed matrix, TW-E04)"
        },
        "openvpn": {
          "disposition": "green",
          "evidence": "real egress HTTP 200x3 through the tunnel, kill switch applied (23.7.5.11D T4.1/T4.2 Tumbleweed validation, TW-E04)"
        },
        "openvpn_cloak": {
          "disposition": "green",
          "evidence": "real egress HTTP 200x3 through the tunnel (23.7.5.11D T4.1 Tumbleweed matrix, TW-E04)"
        },
        "shadowsocks": {
          "disposition": "green",
          "evidence": "real egress HTTP 200x3 through the tunnel, kill switch applied (23.7.5.11D T4.1/T4.2 Tumbleweed validation, TW-E04)"
        },
        "socks": {
          "disposition": "green",
          "evidence": "real egress HTTP 200x3 through the tunnel (23.7.5.11D T4.1 Tumbleweed matrix, TW-E04)"
        },
        "trojan": {
          "disposition": "green",
          "evidence": "real egress HTTP 200x3 through the tunnel (23.7.5.11D T4.1 Tumbleweed matrix, TW-E04)"
        },
        "tuic": {
          "disposition": "green",
          "evidence": "real egress HTTP 200x3 through the tunnel (23.7.5.11D T4.1 Tumbleweed matrix, TW-E04)"
        },
        "vless": {
          "disposition": "green",
          "evidence": "real egress HTTP 200x3 through the tunnel; tunnel egress 138.124.91.224 distinct from direct (23.7.5.11D T4.1 Tumbleweed matrix, TW-E04)"
        },
        "vmess": {
          "disposition": "green",
          "evidence": "real egress HTTP 200x3 through the tunnel (23.7.5.11D T4.1 Tumbleweed matrix, TW-E04)"
        },
        "wireguard": {
          "disposition": "green",
          "evidence": "real egress HTTP 200x3 through the tunnel, kill switch applied (23.7.5.11D T4.1/T4.2 Tumbleweed validation, TW-E04)"
        }
      },
      "scope": "physical_field_certification",
      "snapshot": "openSUSE Tumbleweed 20260907"
    },
    "cert_arch_rolling": {
      "current": true,
      "date": "2026-08-15T00:00:00Z",
      "distribution": "arch",
      "evidence": "23.7.5.11B Arch Linux field recertification on nls1 (runtime cd112b4): 12/12 real-egress protocol matrix; reboot lifecycle autoconnect off/on; isolated fault harness fail-closed (dns_restore_failed/kill_switch_disable_failed); cleanup final standby with doctor FAIL=0; shutdown FAILURE fix cd112b4. Evidence under evidencia_phase23/watchdogvpn-task-23-7-5-11B-arch-nls1-*",
      "protocol_results": {
        "amneziawg": {
          "disposition": "green",
          "evidence": "certification matrix real egress"
        },
        "http": {
          "disposition": "green",
          "evidence": "certification matrix real egress"
        },
        "hysteria2": {
          "disposition": "green",
          "evidence": "certification matrix real egress"
        },
        "openvpn": {
          "disposition": "green",
          "evidence": "23.7.5.11B Arch Linux fresh real-egress field evidence (promoted from formal_non_green)"
        },
        "openvpn_cloak": {
          "disposition": "green",
          "evidence": "certification matrix real egress"
        },
        "shadowsocks": {
          "disposition": "green",
          "evidence": "23.7.5.11B Arch Linux fresh real-egress field evidence (promoted from formal_non_green)"
        },
        "socks": {
          "disposition": "green",
          "evidence": "certification matrix real egress"
        },
        "trojan": {
          "disposition": "green",
          "evidence": "certification matrix real egress"
        },
        "tuic": {
          "disposition": "green",
          "evidence": "certification matrix real egress"
        },
        "vless": {
          "disposition": "green",
          "evidence": "certification matrix real egress"
        },
        "vmess": {
          "disposition": "green",
          "evidence": "certification matrix real egress"
        },
        "wireguard": {
          "disposition": "green",
          "evidence": "23.7.5.11B Arch Linux fresh real-egress field evidence (promoted from formal_non_green)"
        }
      },
      "scope": "physical_field_certification",
      "snapshot": "arch-default-and-lts-2026-07-22"
    },
    "cert_cachyos_rolling": {
      "current": true,
      "date": "2026-08-16T00:00:00Z",
      "distribution": "cachyos",